{
  "aetherius": "1.0",
  "name": "licence.aetherius",
  "description": "Genere par le recorder Aetherius (act continuum) a partir d'une demo sur https://github.com/kln-mltre/Aetherius?tab=License-1-ov-file.",
  "act": "continuum",
  "steps": [
    {
      "action": "navigate",
      "url": "https://github.com/kln-mltre/Aetherius?tab=License-1-ov-file"
    },
    {
      "action": "extract",
      "id": "data",
      "outputs": {
        "licence": {
          "selector": "#repo-content-pjax-container > react-app > div > div:nth-of-type(2) > div:nth-of-type(1) > div > div > div > div > div > div > div > div > div:nth-of-type(1) > div > div > div:nth-of-type(3) > div:nth-of-type(2) > div > div:nth-of-type(2) > div > pre",
          "as": "text"
        }
      }
    }
  ],
  "outputs": {
    "licence": "{{ steps.data.licence }}"
  }
}
