{
  "aetherius": "1.0",
  "name": "github.aetherius",
  "description": "Act II (Continuum) : genere par le recorder depuis une demo sur https://github.com/kln-mltre.",
  "act": "continuum",
  "steps": [
    {
      "action": "navigate",
      "url": "https://github.com/kln-mltre"
    },
    {
      "action": "click",
      "selector": ".tmp-mr-2"
    },
    {
      "action": "click",
      "selector": "License",
      "selector_type": "text"
    },
    {
      "action": "extract",
      "id": "data",
      "outputs": {
        "licence": {
          "selector": "#repo-content-pjax-container > react-app > div > div:nth-of-type(2) > div:nth-of-type(1) > div > div > div > div > div > div > div > div > div:nth-of-type(1) > div > div > div:nth-of-type(3) > div:nth-of-type(2) > div > div:nth-of-type(2) > div > pre",
          "as": "text"
        }
      }
    }
  ],
  "outputs": {
    "licence": "{{ steps.data.licence }}"
  }
}
